{
  "profile_id": "pioneer_avr_generic",
  "name": "Pioneer AV Receiver (Generic)",
  "manufacturer": "Pioneer",
  "device_type": "av_receiver",
  "protocol": "PIONEER",
  "bits": 64,
  "codes": {
    "power": "A55A38C7",
    "power_on": "A55A39C6",
    "power_off": "A55A3AC5",
    "volume_up": "A55A50AF",
    "volume_down": "A55AD02F",
    "mute": "A55A48B7",
    "input_bd": "A55A4AB5",
    "input_dvd": "A55A4AB5",
    "input_tv": "A55AC936",
    "input_sat": "A55A8976",
    "input_hdmi1": "A55AE51A",
    "input_hdmi2": "A55A15EA",
    "input_hdmi3": "A55A55AA",
    "input_hdmi4": "A55AB54A",
    "input_hdmi5": "A55A35CA",
    "input_hdmi6": "A55A758A",
    "input_video": "A55A0AF5",
    "input_cd": "A55AA05F",
    "input_tuner": "A55A609F",
    "input_usb": "A55A7986",
    "input_bluetooth": "A55AF906",
    "input_network": "A55AEB14",
    "surround_auto": "A55A58A7",
    "surround_stereo": "A55A9867",
    "surround_standard": "A55AD827",
    "surround_advanced": "A55AA857",
    "surround_action": "A55A6897",
    "surround_drama": "A55AE817",
    "surround_direct": "A55AA25D",
    "up": "A55A01FE",
    "down": "A55A817E",
    "left": "A55A41BE",
    "right": "A55AC13E",
    "enter": "A55A21DE",
    "return": "A55A11EE",
    "home": "A55AD12E",
    "menu": "A55AE916",
    "tone": "A55A8A75",
    "mcacc": "A55A22DD",
    "listening_mode": "A55A0CF3",
    "sound_retriever": "A55ACA35",
    "display": "A55A20DF",
    "dimmer": "A55AE01F"
  }
}
