{
  "profile_id": "directv_receiver",
  "name": "DirecTV Receiver",
  "manufacturer": "DirecTV",
  "device_type": "cable_box",
  "protocol": "DIRECTV",
  "bits": 0,
  "codes": {
    "power": "POWER",
    "guide": "GUIDE",
    "menu": "MENU",
    "list": "LIST",
    "exit": "EXIT",
    "info": "INFO",
    "up": "UP",
    "down": "DOWN",
    "left": "LEFT",
    "right": "RIGHT",
    "select": "SELECT",
    "channel_up": "CHANUP",
    "channel_down": "CHANDN",
    "prev": "PREV",
    "play": "PLAY",
    "pause": "PAUSE",
    "rewind": "REW",
    "fast_forward": "FFWD",
    "stop": "STOP",
    "record": "REC",
    "0": "0",
    "1": "1",
    "2": "2",
    "3": "3",
    "4": "4",
    "5": "5",
    "6": "6",
    "7": "7",
    "8": "8",
    "9": "9"
  }
}
