{
  "profile_id": "hisense_tv_generic",
  "name": "Hisense TV",
  "manufacturer": "Hisense",
  "device_type": "tv",
  "model": "Most Hisense TVs",
  "protocol": "NEC",
  "bits": 32,
  "codes": {
    "power": "00FDB04F",
    "power_on": "00FD0BF4",
    "power_off": "00FD8B74",
    "volume_up": "00FDC23D",
    "volume_down": "00FD42BD",
    "mute": "00FD708F",
    "channel_up": "00FD52AD",
    "channel_down": "00FDD22D",
    "input": "00FD48B7",
    "menu": "00FD8A75",
    "home": "00FD04FB",
    "guide": "00FD629D",
    "info": "00FD58A7",
    "exit": "00FD9A65",
    "back": "00FD1AE5",
    "up": "00FDA25D",
    "down": "00FD22DD",
    "left": "00FDE21D",
    "right": "00FD12ED",
    "ok": "00FDA857",
    "red": "00FD32CD",
    "green": "00FDB24D",
    "yellow": "00FD728D",
    "blue": "00FDF20D",
    "0": "00FD00FF",
    "1": "00FD807F",
    "2": "00FD40BF",
    "3": "00FDC03F",
    "4": "00FD20DF",
    "5": "00FDA05F",
    "6": "00FD609F",
    "7": "00FDE01F",
    "8": "00FD10EF",
    "9": "00FD906F"
  }
}
