{
  "profile_id": "toshiba_tv",
  "name": "Toshiba TV",
  "manufacturer": "Toshiba",
  "device_type": "tv",
  "model": "Toshiba TVs and Fire TV Edition",
  "protocol": "NEC",
  "bits": 32,
  "codes": {
    "power": "02FD48B7",
    "power_on": "02FD08F7",
    "power_off": "02FD8877",
    "volume_up": "02FD58A7",
    "volume_down": "02FDD827",
    "mute": "02FDA857",
    "channel_up": "02FDD02F",
    "channel_down": "02FDF00F",
    "input": "02FDF20D",
    "input_tv": "02FD28D7",
    "input_hdmi1": "02FD6A95",
    "input_hdmi2": "02FDEA15",
    "input_hdmi3": "02FD1AE5",
    "input_hdmi4": "02FD9A65",
    "input_av": "02FD32CD",
    "input_component": "02FDB24D",
    "menu": "02FD38C7",
    "home": "02FD42BD",
    "guide": "02FD9A65",
    "info": "02FDC837",
    "exit": "02FDB847",
    "back": "02FD52AD",
    "up": "02FD02FD",
    "down": "02FD827D",
    "left": "02FDE21D",
    "right": "02FD629D",
    "ok": "02FD22DD",
    "red": "02FD728D",
    "green": "02FDF20D",
    "yellow": "02FD32CD",
    "blue": "02FDB24D",
    "play": "02FD01FE",
    "pause": "02FD817E",
    "stop": "02FD41BE",
    "rewind": "02FD21DE",
    "fast_forward": "02FDA15E",
    "sleep": "02FD6897",
    "aspect": "02FDE817",
    "0": "02FD00FF",
    "1": "02FD807F",
    "2": "02FD40BF",
    "3": "02FDC03F",
    "4": "02FD20DF",
    "5": "02FDA05F",
    "6": "02FD609F",
    "7": "02FDE01F",
    "8": "02FD10EF",
    "9": "02FD906F"
  }
}
