{
  "profile_id": "lg_tv",
  "name": "LG TV",
  "manufacturer": "LG",
  "device_type": "tv",
  "model": "Most LG TVs 2008+",
  "protocol": "NEC",
  "bits": 32,
  "codes": {
    "power": "20DF10EF",
    "power_on": "20DF23DC",
    "power_off": "20DFA35C",
    "volume_up": "20DF40BF",
    "volume_down": "20DFC03F",
    "mute": "20DF906F",
    "channel_up": "20DF00FF",
    "channel_down": "20DF807F",
    "input": "20DFD02F",
    "input_tv": "20DF6B94",
    "input_hdmi1": "20DF738C",
    "input_hdmi2": "20DF33CC",
    "input_hdmi3": "20DF9768",
    "input_hdmi4": "20DF5BA4",
    "input_av1": "20DF5AA5",
    "input_av2": "20DF0BF4",
    "input_component1": "20DFFD02",
    "input_component2": "20DF2BD4",
    "menu": "20DFC23D",
    "home": "20DF3EC1",
    "settings": "20DFC23D",
    "guide": "20DFD52A",
    "info": "20DF55AA",
    "exit": "20DFDA25",
    "back": "20DF14EB",
    "up": "20DF02FD",
    "down": "20DF827D",
    "left": "20DFE01F",
    "right": "20DF609F",
    "ok": "20DF22DD",
    "red": "20DF4EB1",
    "green": "20DF8E71",
    "yellow": "20DFC639",
    "blue": "20DF8679",
    "aspect_4_3": "20DFF10E",
    "aspect_16_9": "20DFF708",
    "0": "20DF08F7",
    "1": "20DF8877",
    "2": "20DF48B7",
    "3": "20DFC837",
    "4": "20DF28D7",
    "5": "20DFA857",
    "6": "20DF6897",
    "7": "20DFE817",
    "8": "20DF18E7",
    "9": "20DF9867"
  }
}
