{
  "profile_id": "sony_tv_generic",
  "name": "Sony TV (Generic)",
  "manufacturer": "Sony",
  "device_type": "tv",
  "protocol": "SONY",
  "bits": 12,
  "codes": {
    "power": "A90",
    "power_on": "750",
    "power_off": "F50",
    "volume_up": "490",
    "volume_down": "C90",
    "mute": "290",
    "channel_up": "090",
    "channel_down": "890",
    "source": "A50",
    "menu": "070",
    "enter": "A70",
    "exit": "C70",
    "up": "2F0",
    "down": "AF0",
    "left": "2D0",
    "right": "CD0",
    "guide": "6D0",
    "info": "5D0",
    "0": "910",
    "1": "010",
    "2": "810",
    "3": "410",
    "4": "C10",
    "5": "210",
    "6": "A10",
    "7": "610",
    "8": "E10",
    "9": "110"
  }
}
