{
  "profile_id": "samsung_tv_generic",
  "name": "Samsung TV (Generic)",
  "manufacturer": "Samsung",
  "device_type": "tv",
  "protocol": "SAMSUNG",
  "bits": 32,
  "codes": {
    "power": "E0E040BF",
    "power_on": "E0E09966",
    "power_off": "E0E019E6",
    "volume_up": "E0E0E01F",
    "volume_down": "E0E0D02F",
    "mute": "E0E0F00F",
    "channel_up": "E0E048B7",
    "channel_down": "E0E008F7",
    "source": "E0E0807F",
    "hdmi": "E0E0D12E",
    "menu": "E0E058A7",
    "enter": "E0E016E9",
    "exit": "E0E0B44B",
    "up": "E0E006F9",
    "down": "E0E08679",
    "left": "E0E0A659",
    "right": "E0E046B9",
    "back": "E0E01AE5",
    "home": "E0E09E61",
    "guide": "E0E0F20D",
    "info": "E0E0F807",
    "0": "E0E08877",
    "1": "E0E020DF",
    "2": "E0E0A05F",
    "3": "E0E0609F",
    "4": "E0E010EF",
    "5": "E0E0906F",
    "6": "E0E050AF",
    "7": "E0E030CF",
    "8": "E0E0B04F",
    "9": "E0E0708F"
  }
}
