{
  "profile_id": "onkyo_avr",
  "name": "Onkyo AV Receiver",
  "manufacturer": "Onkyo",
  "device_type": "av_receiver",
  "model": "TX-NR series, TX-RZ series, most Onkyo receivers",
  "protocol": "NEC",
  "bits": 32,
  "codes": {
    "power": "4B36D32C",
    "power_on": "4B36E31C",
    "power_off": "4B3613EC",
    "volume_up": "4B36F10E",
    "volume_down": "4B3611EE",
    "mute": "4B3651AE",
    "input_cd": "4B36C33C",
    "input_tuner": "4B36837C",
    "input_phono": "4B36A35C",
    "input_dvd": "4B36916E",
    "input_bluray": "4B3601FE",
    "input_tv": "4B36B14E",
    "input_cbl_sat": "4B3631CE",
    "input_game": "4B36718E",
    "input_pc": "4B36F906",
    "input_aux": "4B36E11E",
    "input_hdmi1": "4B3649B6",
    "input_hdmi2": "4B36C936",
    "input_hdmi3": "4B3629D6",
    "input_hdmi4": "4B36A956",
    "input_hdmi5": "4B366996",
    "input_hdmi6": "4B36E916",
    "input_hdmi7": "4B3619E6",
    "input_usb": "4B3661A6",
    "input_bluetooth": "4B36D12E",
    "input_net": "4B36C13E",
    "surround_stereo": "4B36619E",
    "surround_direct": "4B36E11E",
    "surround_dolby": "4B3621DE",
    "surround_dts": "4B36A15E",
    "surround_thx": "4B3651AE",
    "surround_movie": "4B36F10E",
    "surround_music": "4B3611EE",
    "surround_game": "4B3691EE",
    "listening_mode_up": "4B3639C6",
    "listening_mode_down": "4B36B946",
    "menu": "4B36D926",
    "up": "4B36A956",
    "down": "4B366996",
    "left": "4B36C936",
    "right": "4B3649B6",
    "enter": "4B3609F6",
    "back": "4B3659A6",
    "home": "4B36E916",
    "info": "4B3629D6",
    "setup": "4B36F906",
    "dimmer": "4B36817E"
  }
}
