{
  "profile_id": "panasonic_tv",
  "name": "Panasonic TV",
  "manufacturer": "Panasonic",
  "device_type": "tv",
  "model": "Most Panasonic TVs",
  "protocol": "PANASONIC",
  "bits": 48,
  "codes": {
    "power": "400401003C3D",
    "power_on": "400401003E3F",
    "power_off": "400401003F3E",
    "volume_up": "400401000405",
    "volume_down": "400401000504",
    "mute": "400401000C0D",
    "channel_up": "400401002C2D",
    "channel_down": "400401002D2C",
    "input": "400401000A0B",
    "input_tv": "400401005051",
    "input_av": "400401000E0F",
    "input_hdmi1": "4004014949",
    "input_hdmi2": "4004014A4A",
    "input_hdmi3": "4004014B4B",
    "input_hdmi4": "4004014C4C",
    "menu": "400401000D0C",
    "home": "40040100D0D1",
    "guide": "400401004C4D",
    "info": "400401003938",
    "exit": "400401004B4A",
    "back": "400401002B2A",
    "up": "400401005253",
    "down": "400401005352",
    "left": "400401005756",
    "right": "400401005657",
    "ok": "400401004948",
    "red": "400401000E0F",
    "green": "400401000F0E",
    "yellow": "400401001011",
    "blue": "400401001110",
    "aspect": "400401002322",
    "0": "400401001817",
    "1": "400401001009",
    "2": "400401001108",
    "3": "400401001209",
    "4": "4004010013OC",
    "5": "400401001409",
    "6": "4004010015OC",
    "7": "400401001609",
    "8": "4004010017OC",
    "9": "400401001809"
  }
}
