{
  "profile_id": "denon_avr",
  "name": "Denon AV Receiver",
  "manufacturer": "Denon",
  "device_type": "av_receiver",
  "model": "AVR-X series, AVR-S series, most Denon receivers",
  "protocol": "DENON",
  "bits": 15,
  "codes": {
    "power": "0100",
    "power_on": "0180",
    "power_off": "8100",
    "volume_up": "0140",
    "volume_down": "8140",
    "mute": "0104",
    "mute_on": "0084",
    "mute_off": "8084",
    "input_cd": "0118",
    "input_tuner": "0108",
    "input_dvd": "0158",
    "input_bluray": "01A8",
    "input_tv": "0198",
    "input_cbl_sat": "0168",
    "input_media_player": "8168",
    "input_game": "8178",
    "input_aux1": "8128",
    "input_aux2": "8198",
    "input_phono": "0110",
    "input_hdmi1": "4D48",
    "input_hdmi2": "4D58",
    "input_hdmi3": "4D68",
    "input_hdmi4": "4D78",
    "input_hdmi5": "4D88",
    "input_hdmi6": "4D98",
    "surround_auto": "0126",
    "surround_stereo": "0186",
    "surround_dolby": "01A6",
    "surround_dts": "8126",
    "surround_movie": "8186",
    "surround_music": "81A6",
    "surround_game": "81E6",
    "surround_direct": "0166",
    "surround_pure_direct": "8166",
    "channel_up": "01CD",
    "channel_down": "81CD",
    "menu": "0134",
    "up": "0162",
    "down": "8162",
    "left": "0172",
    "right": "8172",
    "enter": "01E2",
    "back": "8134",
    "info": "01F4",
    "sleep": "01B4"
  }
}
