{
  "profile_id": "yamaha_avr",
  "name": "Yamaha AV Receiver",
  "manufacturer": "Yamaha",
  "device_type": "av_receiver",
  "model": "RX-V series, RX-A series, most Yamaha receivers",
  "protocol": "NEC",
  "bits": 32,
  "codes": {
    "power": "5EA1F807",
    "power_on": "5EA1E21D",
    "power_off": "5EA11AE5",
    "volume_up": "5EA158A7",
    "volume_down": "5EA1D827",
    "mute": "5EA138C7",
    "mute_on": "5EA1A05F",
    "mute_off": "5EA1609F",
    "input_cd": "5EA1A857",
    "input_tuner": "5EA16897",
    "input_phono": "5EA128D7",
    "input_dvd": "5EA1C03F",
    "input_bluray": "5EA10BF4",
    "input_tv": "5EA12AD5",
    "input_cbl_sat": "5EA1AA55",
    "input_hdmi1": "5EA1E31C",
    "input_hdmi2": "5EA152AD",
    "input_hdmi3": "5EA1B24D",
    "input_hdmi4": "5EA10AF5",
    "input_hdmi5": "5EA18A75",
    "input_hdmi6": "5EA14AB5",
    "input_aux": "5EA1EA15",
    "input_audio1": "5EA18877",
    "input_audio2": "5EA148B7",
    "input_av1": "5EA1C837",
    "input_av2": "5EA108F7",
    "input_av3": "5EA18877",
    "input_av4": "5EA148B7",
    "input_usb": "5EA1718E",
    "input_bluetooth": "5EA1F10E",
    "input_net_radio": "5EA1B14E",
    "surround_straight": "5EA1E01F",
    "surround_stereo": "5EA1906F",
    "surround_enhancer": "5EA150AF",
    "surround_sci_fi": "5EA110EF",
    "surround_movie": "5EA1D02F",
    "surround_music": "5EA130CF",
    "program_up": "5EA140BF",
    "program_down": "5EA1C03F",
    "menu": "5EA1B04F",
    "up": "5EA19867",
    "down": "5EA118E7",
    "left": "5EA1A25D",
    "right": "5EA1629D",
    "enter": "5EA1D22D",
    "back": "5EA122DD",
    "info": "5EA1E817",
    "option": "5EA16B94",
    "scene1": "5EA17887",
    "scene2": "5EA1B847",
    "scene3": "5EA138C7",
    "scene4": "5EA1F00F"
  }
}
