{
  "profile_id": "sony_avr",
  "name": "Sony AV Receiver",
  "manufacturer": "Sony",
  "device_type": "av_receiver",
  "model": "STR-DN series, STR-DH series, most Sony receivers",
  "protocol": "SONY",
  "bits": 15,
  "codes": {
    "power": "540C",
    "power_on": "2E0C",
    "power_off": "AE0C",
    "volume_up": "240C",
    "volume_down": "640C",
    "mute": "140C",
    "mute_on": "940C",
    "mute_off": "140C",
    "input_cd": "A50C",
    "input_tuner": "850C",
    "input_phono": "090C",
    "input_dvd": "C20C",
    "input_bluray": "188C",
    "input_tv": "2A0C",
    "input_sat": "6C8C",
    "input_video": "C10C",
    "input_hdmi1": "1D8C",
    "input_hdmi2": "5D8C",
    "input_hdmi3": "3D8C",
    "input_hdmi4": "7D8C",
    "input_hdmi5": "0D8C",
    "input_hdmi6": "4D8C",
    "input_aux": "590C",
    "input_usb": "368C",
    "input_bluetooth": "0E8C",
    "input_fm": "C50C",
    "input_am": "450C",
    "surround_2ch": "580C",
    "surround_afd": "E70C",
    "surround_multi_stereo": "370C",
    "surround_plii_movie": "F10C",
    "surround_plii_music": "710C",
    "surround_neo_cinema": "B10C",
    "surround_neo_music": "310C",
    "surround_movie": "968C",
    "surround_music": "168C",
    "surround_direct": "D80C",
    "menu": "B20C",
    "up": "780C",
    "down": "F80C",
    "left": "1E0C",
    "right": "5E0C",
    "enter": "D20C",
    "back": "620C",
    "home": "2D8C",
    "options": "360C",
    "display": "690C",
    "sleep": "D00C",
    "dimmer": "E80C"
  }
}
