{
  "profile_id": "vizio_tv_generic",
  "name": "Vizio TV (Generic)",
  "manufacturer": "Vizio",
  "device_type": "tv",
  "protocol": "NEC",
  "bits": 32,
  "codes": {
    "power": "20DF10EF",
    "power_on": "20DF23DC",
    "power_off": "20DFA35C",
    "volume_up": "20DF40BF",
    "volume_down": "20DFC03F",
    "mute": "20DF906F",
    "channel_up": "20DF00FF",
    "channel_down": "20DF807F",
    "source": "20DFD02F",
    "menu": "20DFC23D",
    "enter": "20DF22DD",
    "exit": "20DFDA25",
    "up": "20DF02FD",
    "down": "20DF827D",
    "left": "20DFE01F",
    "right": "20DF609F",
    "back": "20DF14EB",
    "info": "20DF55AA",
    "0": "20DF08F7",
    "1": "20DF8877",
    "2": "20DF48B7",
    "3": "20DFC837",
    "4": "20DF28D7",
    "5": "20DFA857",
    "6": "20DF6897",
    "7": "20DFE817",
    "8": "20DF18E7",
    "9": "20DF9867",
    "hdmi1": "20DF738C",
    "hdmi2": "20DF33CC",
    "component": "20DFFD02",
    "av": "20DF5AA5"
  }
}
