{
  "profile_id": "sharp_tv",
  "name": "Sharp TV",
  "manufacturer": "Sharp",
  "device_type": "tv",
  "model": "Sharp Aquos and Roku TV series",
  "protocol": "SHARP",
  "bits": 15,
  "codes": {
    "power": "41A2",
    "power_on": "41E2",
    "power_off": "41F2",
    "volume_up": "4022",
    "volume_down": "4122",
    "mute": "4322",
    "channel_up": "4222",
    "channel_down": "4322",
    "input": "4522",
    "input_tv": "40A2",
    "input_hdmi1": "4702",
    "input_hdmi2": "4712",
    "input_hdmi3": "4722",
    "input_hdmi4": "4732",
    "input_av": "4402",
    "input_component": "4482",
    "menu": "44A2",
    "home": "46A2",
    "guide": "4B02",
    "info": "4922",
    "exit": "45A2",
    "back": "4622",
    "up": "4722",
    "down": "4822",
    "left": "4922",
    "right": "4A22",
    "ok": "4B22",
    "red": "4C22",
    "green": "4D22",
    "yellow": "4E22",
    "blue": "4F22",
    "sleep": "4BA2",
    "aspect": "43A2",
    "0": "4002",
    "1": "4012",
    "2": "4022",
    "3": "4032",
    "4": "4042",
    "5": "4052",
    "6": "4062",
    "7": "4072",
    "8": "4082",
    "9": "4092"
  }
}
