{
  "profile_id": "marantz_avr",
  "name": "Marantz AV Receiver",
  "manufacturer": "Marantz",
  "device_type": "av_receiver",
  "model": "SR series, NR series, most Marantz receivers",
  "protocol": "DENON",
  "bits": 15,
  "codes": {
    "power": "2100",
    "power_on": "2180",
    "power_off": "A100",
    "volume_up": "2140",
    "volume_down": "A140",
    "mute": "2104",
    "mute_on": "2084",
    "mute_off": "A084",
    "input_cd": "2118",
    "input_tuner": "2108",
    "input_dvd": "2158",
    "input_bluray": "21A8",
    "input_tv": "2198",
    "input_cbl_sat": "2168",
    "input_media_player": "A168",
    "input_game": "A178",
    "input_aux1": "A128",
    "input_aux2": "A198",
    "input_phono": "2110",
    "input_hdmi1": "4D48",
    "input_hdmi2": "4D58",
    "input_hdmi3": "4D68",
    "input_hdmi4": "4D78",
    "input_hdmi5": "4D88",
    "input_hdmi6": "4D98",
    "surround_auto": "2126",
    "surround_stereo": "2186",
    "surround_dolby": "21A6",
    "surround_dts": "A126",
    "surround_movie": "A186",
    "surround_music": "A1A6",
    "surround_direct": "2166",
    "surround_pure_direct": "A166",
    "channel_up": "21CD",
    "channel_down": "A1CD",
    "menu": "2134",
    "up": "2162",
    "down": "A162",
    "left": "2172",
    "right": "A172",
    "enter": "21E2",
    "back": "A134",
    "info": "21F4",
    "m_dax": "A1E8",
    "tone_control": "21B0",
    "sleep": "21B4"
  }
}
