{
  "profile_id": "epson_projector",
  "name": "Epson Projector",
  "manufacturer": "Epson",
  "device_type": "projector",
  "model": "PowerLite Home Cinema 2000/2030/3000 series",
  "protocol": "NEC",
  "bits": 32,
  "codes": {
    "power": "8355906F",
    "power_on": "8355906F",
    "power_off": "8355916E",
    "menu": "83559A65",
    "esc": "8355847B",
    "enter": "835528D7",
    "up": "8355B04F",
    "down": "8355B24D",
    "left": "8355B34C",
    "right": "8355B14E",
    "source": "835504FB",
    "input_hdmi1": "8355738C",
    "input_hdmi2": "83557788",
    "input_component": "83557188",
    "input_video": "83557089",
    "input_pc": "83559D62",
    "input_usb": "8355768C",
    "color_mode": "83558F70",
    "aspect": "83558A75",
    "blank": "835556A9",
    "volume_up": "83559867",
    "volume_down": "83559966",
    "mute": "8355AD52",
    "play": "83555EA1",
    "pause": "83555BA4",
    "stop": "835559A6",
    "rewind": "83555AA5",
    "fast_forward": "83555CA3"
  }
}
